,Question,Answers,Right Index
94,You stashed three sets of changes but cannot remember the contents of the first stash entry. What command would you use to see the details of the changes in the first of the three stash entries?,"['Use git branch <stash hash>.', 'Add the stashed commits to the current commit, then create a new branch.', 'Use git checkout -b.', 'Run git stash branch <branch name>.']",3
95,Which statement is true of the git push command?,"['-D deletes the local branch, while -d deletes the branch regardless of push and merge status.', '-d deletes the current commit head, while -D deletes the entire branch.', '-d deletes the local branch, while -D deletes the local branch regardless of push and merge status.', '-D deletes the current commit head, while -d deletes the entire branch.']",2
96,How would you delete a remote branch in your repository?,"['git stash show -p stash@{2}', 'git stash list', 'git stash show -p stash@{1}', 'git stash show -p']",0
97,What is the default setting of git reflog when no subcommands are specified?,"[""By default, a push doesn't send tags to the remote repository."", 'Only annotated tags are automatically pushed to the remote repository with a commit.', 'Tags are pushed to the remote repository with their respective commits.', 'Commits can be tagged only when they are created.']",0
98,How does the -p option change the behavior of the git add command,"['Use git --delete <branch_name>.', 'Use git push <remote_name> --d <branch_name>.', 'Use git push <remote_name> --D.', 'Use git push <remote_name> --delete <branch_name>.']",3
99,"After checking out a specific commit, you receive a warning message indicating You are in 'detached HEAD' state. What is Git warning you of?","['delete', 'expire', 'show', 'update']",2
100,"After accidentally deleting a branch in your local repository, how can you recover it?","['It causes tracked files in the parent directory to be included in the staged files.', 'It allows developers to interactively choose which changes to tracked files are staged and outputs the differences for review.', 'It automatically pushes changes to the corresponding branch on the remote repository.', 'It allows developers to interactively choose which files are committed and outputs the differences for review.']",1
101,"How would you display a histogram showing inserts, deletion, and modifications per file for a specific commit along with its general commit information?","['You are not working on the most recent commit of a branch.', 'A teammate has flagged the code with an issue.', 'The commit does not have a parent.', 'The branch has not been pushed to the remote repository.']",0
102,What features do repository managers such as GitHub provide beyond Git?,"['It cannot be recovered.', 'Find the hash of the branch with the log command, then execute git checkout -b <branchname> <hash>.', 'Find the hash of the branch with the reflog command, then execute git checkout -b <branchname> <hash>.', 'Execute git checkout -b <branchname>.']",2
103,What command finds the HEAD of the current branch?,"['Use git stat.', 'Use git debug --prettyprint.', 'Query the remote repository with the commit hash.', 'Use git show <commit> --stat.']",3
104,"When Git Workflows contain a long-running branch, what purpose does the long-running branch serve?","['Repository managers are proprietary versions of Git that do not include enhanced features.', 'Repository managers provide an enhanced command-line tool that is used to manage multiple local repositories.', 'Repository managers provide an online service for hosting Git repositories that include collaboration features such as pull requests, issue tracking, and peer reviews.', ""Repository managers distribute repositories across multiple locations on a user's workstation, providing redundant storage that allows for quick backup and recovery.""]",2
105,What command takes changes from the master branch on the remote repository orgin and merges then to the local checked-out branch?,"['git head --verify', 'git log --head', 'git hash --head', 'git show-ref --head']",3
106,"While pushing changes to a remote repository, you receive the following message. How do you resolve this issue?","['Long-running branches store unstable code until it os peer reviewed for integration into a feature branch.', 'Long-running branches correspond to agile sprints and are used to store related to features developed in the sprint.', 'Long-running branches contain code related to expiremental feature development that is merged into short-lived branches such as master.', 'Long-running branches correspond to different stages of development and are allways open for topic/feature branches to be pulled into.']",3
107,What does the -p option add to the output of the git log command?,"['git commit -u origin', 'git checkout origin', 'git pull origin master', 'git push origin master']",2
108,What is the staging area or index?,"['Use the --atomic option with the push command.', 'Execute a pull, then resolve any merge conflicts and execute another push.', 'Execute a fetch, then execute another push.', 'Use the --force option with the push command.']",1
109,What command would you use to stage changes to the index strictly for properties files in the current directory?,"['It adds patch output that shows the differences introduced in each commit.', 'It adds patch output that shows a summary listing modified files.', 'It adds padding to the output and displays a histogram showing the number of lines changed in each commit.', 'It adds the full commit message and notes associated with each commit.']",1
110,What are untracked files?,"['an area that stores commits prior to them being pushed to the remote repository', 'an area containing stash entries that can applied to the working files', 'an area where changes from a branch in the remote repository are stored before they are applied to a local branch', 'an area that stores information about changes that will be included in the next commit']",3
111,What command takes changes from the master branch on the remote repository origin and merges them to the local checked-out branch?,"['git add *.properties', 'git add %.properties', 'git add .properties', 'git add properties']",0
112,What type of Git hook could be used to validate that a commit message contains a ticket number?,"['files in the local repository that have not been merged into the master branch', 'staged files that Git does not know about because the have not been committed', 'files in the working directory that Git does not know about because the have not been staged or committed', 'files in the remote repository that Git does not know about because they have not been tagged']",2
113,What is the difference between git stash pop and git stash apply?,"['git checkout origin', 'git commit -u origin', 'git pull origin master', 'git push origin master']",2
114,"After making some major changes to your code, you are a little nervous about committing. What command would you use to review the commit prior to making it?","['pre-commit', 'commit-msg', 'applypatch-msg', 'prepare-commit-msg']",1
115,What statement best describes Git's concept of HEAD?,"['git stash pop pushes the topmost commit to the current branch, while git stash apply caches the last commit in the current branch.', 'git stash pop applies the topmost entry in the stash to the working files and removes it from the stash, while git stash apply applies the topmost entry in the stash to the working files but leaves it in the stash.', 'git stash pop merges the topmost commit to the current branch, while git stash apply merges the last commit in the current branch.', 'git stash pop applies the topmost entry in the stash to the working files but leaves it in the stash, while git stash apply applies the topmost entry in the stash to the working files and removes it from the stash.']",1
116,"After staging changes to several files, you realize the changes to the confin.properties file are incorrect, and need to be removed from the stage and working directory. What command can you use to remove the staged changes to the file?","['git commit --verify', 'git notes show', 'git commit preview', 'git commit --dry-run']",3
117,"After a recent release with a stack trace, an issue is create that indicates the problem is with a newly added configuration property named MaxConnections. What command can find all commits that add or remove the string MaxConnections?","['a pointer to the most recently changed file in the stage/index', 'a pointer to the master branch', 'a pointer to the most recent commit in the currently checked-out branch', 'a pointer to where the repository is stored in memory']",2
118,Your company has moved its remote repository to GitHub at this location: https://github.com/yourcompany/core-api.git. What command updates the,"['git reset HEAD^ -- config.properties', 'git rm config.properties', 'git rf config.properties', 'git checkout HEAD -- config.properties']",1
119,When is the cherry-pick command used?,"['- git grep -a ""MaxConnections""', '- git log --search-string ""MaxConnections""', '- git log -S ""MaxConnections""', '- git commit --with ""MaxConnections""']",2
120,How would you describe a fokred repository?,"['- git remote create-update origin https://github.com/yourcompany/core-api.git', '- git remote update origin https://github.com/yourcompany/core-api.git', '- git remote set-url origin https://github.com/yourcompany/core-api.git', '- git remote add https://github.com/yourcompany/core-api.git']",2
121,How can you exclude untracked files within the working directory from a Git repository?,"['- when a commit from one branch needs to be copied into another branch', '- when the HEAD needs to be reset to a specific commit', '- when a specific commit needs to be pulled down from the remote repository', '- when a hook script needs to be invoked']",0
122,,"['- a deleted or archived copy of a repository', '- a beta release branch of a repository', '- a future branch of a repository', '- a separate copy of a repository']",3
123,,"['- You cannot exclude the files from the repository.', '- Tag the files with excluded.', '- Add a pattern matching the files to the .gitignore file.', '- Add the files to the omitted branch']",2
