,Question,Answers,Right Index
0,Which operator returns true if the two compared values are not equal?,"['<>', '~', '==!', '!==']",3
1,How is a forEach statement different from a for statement?,"['Only a for statement uses a callback function.', 'A for statement is generic, but a forEach statement can be used only with an array.', 'Only a forEach statement lets you specify your own iterator.', 'A forEach statement is generic, but a for statement can be used only with an array.']",1
2,Review the code below. Which statement calls the addTax function and passes 50 as an argument? How would you use this function to find out how much tax should be paid on \$50?,"['addTax = 50;', 'return addTax 50;', 'addTax(50);', 'addTax 50;']",2
3,Which statement is the correct way to create a variable called rate and assign it the value 100?,"['let rate = 100;', 'let 100 = rate;', '100 = let rate;', 'rate = 100;']",0
4,"Which statement creates a new object using the Person constructor? Which statement creates a new Person object called ""student""?","['var student = new Person();', 'var student = construct Person;', 'var student = Person();', 'var student = construct Person();']",0
5,When would the final statement in the code shown be logged to the console? When would 'results shown' be logged to the console?,"['after 10 second', 'after results are received from the HTTP request', 'after 10000 seconds', 'immediately']",3
6,"Which snippet could you add to this code to print ""food"" to the console?","['a.prototype.belly[0]', 'Object.getPrototype0f (a).belly[0]', 'Animal.belly[0]', 'a.belly[0]']",2
7,"You've written the code shown to log a set of consecutive values, but it instead results in the value 5, 5, 5, and 5 being logged to the console. Which revised version of the code would result in the value 1, 2, 3 and 4 being logged?",['.'],-1
8,How does a function create a closure?,['.'],-1
9,Which statement creates a new function called discountPrice?,['.'],0
10,What is the result in the console of running the code shown?,['.'],-1
11,You need to match a time value such as 12:00:32. Which of the following regular expressions would work for your code?,"['It reloads the document whenever the value changes.', 'It returns a reference to a variable in its parent scope.', 'It completes execution without returning.', 'It copies a local variable to the global scope.']",1
12,What is the result in the console of running this code?,['.'],0
13,How would you reference the text 'avenue' in the code shown?,['.'],-1
14,What is the result of running this statement?,['.'],-1
15,Which property references the DOM object that dispatched an event?,['.'],-1
16,You're adding error handling to the code shown. Which code would you include within the if statement to specify an error message?,"['Storm()', 'undefined', ""'rain'"", ""'snow'""]",3
17,Which method converts JSON data to a JavaScript object?,"['/[0-9]{2,}:[0-9]{2,}:[0-9]{2,}/', '/\\d\\d:\\d\\d:\\d\\d/', '/[0-9]+:[0-9]+:[0-9]+/', '/ : : /']",1
18,When would you use a conditional statement?,"['undefined', 'window', '{desc: ""logger""}', 'function']",2
19,What would be the result in the console of running this code?,"['roadTypes.2', 'roadTypes[3]', 'roadTypes.3', 'roadTypes[2]']",3
20,Which Object method returns an iterable that can be used to iterate over the properties of an object?,"[""'float'"", ""'value'"", ""'number'"", ""'integer'""]",2
21,What will be logged to the console?,"['self', 'object', 'target', 'source']",2
22,What is one difference between collections created with Map and collections created with Object?,"[""exception('One or both parameters are not numbers')"", ""catch('One or both parameters are not numbers')"", ""error('One or both parameters are not numbers')"", ""throw('One or both parameters are not numbers')""]",3
23,What is the value of dessert.type after executing this code?,"['JSON.fromString();', 'JSON.parse()', 'JSON.toObject()', 'JSON.stringify()']",1
24,0 && hi,"['When you want to reuse a set of statements multiple times.', 'When you want your code to choose between multiple options.', 'When you want to group data together.', 'When you want to loop through a group of statement.']",1
25,Which of the following operators can be used to do a short-circuit evaluation?,"['1 2 3 4 5', '1 2 3 4', '0 1 2 3 4', '0 1 2 3 4 5']",2
26,Which statement sets the Person constructor as the parent of the Student constructor in the prototype chain?,"['Object.get()', 'Object.loop()', 'Object.each()', 'Object.keys()']",3
27,"Why would you include a ""use strict"" statement in a JavaScript file?","['101', '3', '4', '100']",0
28,Which Variable-defining keyword allows its variable to be accessed (as undefined) before the line that defines it?,"['You can iterate over values in a Map in their insertion order.', 'You can count the records in a Map with a single method call.', 'Keys in Maps can be strings.', 'You can access values in a Map without iterating over the whole collection.']",1
29,Which of the following values is not a Boolean false?,"['pie', 'The code will throw an error.', 'pudding', 'undefined']",2
30,Which of the following is not a keyword in JavaScript?,"['ReferenceError', 'True', '0', 'false']",2
31,Which variable is an implicit parameter for every function in JavaScript?,"['\\++', '\\--', '\\==', '\\|\\|']",3
32,"For the following class, how do you get the value of 42 from an instance of X?","['Student.parent = Person;', 'Student.prototype = new Person();', 'Student.prototype = Person;', 'Student.prototype = Person();']",1
33,What is the result of running this code?,"['to tell parsers to interpret your JavaScript syntax loosely', 'to tell parsers to enforce all JavaScript syntax rules when processing your code', 'to instruct the browser to automatically fix any errors it finds in the code', 'to enable ES6 features in your code']",1
34,Why is it usually better to work with Objects instead of Arrays to store a collection of records?,"['all of them', 'const', 'var', 'let']",2
35,"Which statement is true about the ""async"" attribute for the HTML script tag?","['Boolean(0)', 'Boolean("""")', 'Boolean(NaN)', 'Boolean(""false"")']",3
36,"How do you import the lodash library making it top-level Api available as the ""_"" variable?","['this', 'catch', 'function', 'array']",3
37,What does the following expression evaluate to?,"['Arguments', 'args', 'argsArray', 'argumentsList']",0
38,What type of function can have its execution suspended and then resumed at a later point?,"[""x.get('Y')"", 'x.Y', 'x.Y()', 'x.get().Y']",1
39,What will this code print?,"['30, ReferenceError, 30, -10', '30, ReferenceError', '30, -10', 'ReferenceError, -10']",1
40,Which statement is true about Functional Programming?,"['Objects are more efficient in terms of storage.', 'Adding a record to an object is significantly faster than pushing a record into an array.', 'Most operations involve looking up a record, and objects can do that better than arrays.', 'Working with objects makes the code more readable.']",2
41,Your code is producing the error: TypeError: Cannot read property 'reduce' of undefined. What does that mean?,"['It can be used for both internal and external JavaScript code.', 'It can be used only for internal JavaScript code.', 'It can be used only for internal or external JavaScript code that exports a promise.', 'It can be used only for external JavaScript code.']",3
42,How many prototype objects are in the chain for the following array?,"[""import _ from 'lodash';"", ""import 'lodash' as _;"", ""import '_' from 'lodash;"", ""import lodash as _ from 'lodash';""]",0
43,Which choice is not a unary operator?,"['True', 'undefined', '[]', 'False']",3
44,What type of scope does the end variable have in the code shown?,"['Generator function', 'Arrow function', 'Async/ Await function', 'Promise function']",0
45,What will the value of y be in this code:,"['2', '1', 'Nothing - this code will throw an error.', 'undefined']",1
46,Which keyword is used to create an error?,"['Every object in the program has to be a function.', 'Code is grouped with the state it modifies.', 'Date fields and methods are kept in units.', 'Side effects are not allowed.']",3
47,What's one difference between the async and defer attributes of the HTML script tag?,"[""You are calling a method named reduce on an object that's declared but has no value."", 'You are calling a method named reduce on an object that does not exist.', 'You are calling a method named reduce on an empty array.', ""You are calling a method named reduce on an object that's has a null value.""]",0
48,The following program has a problem. What is it?,"['3', '2', '0', '1']",1
49,Which statement references the DOM node created by the code shown?,"['typeof', 'delete', 'instanceof', 'void']",2
50,What value does this code return?,"['conditional', 'block', 'global', 'function']",1
51,What is the result in the console of running the code shown?,"['One', 'undefined', 'TRUE', 'Two']",3
52,What will this code log in the console?,"['throw', 'exception', 'catch', 'error']",0
53,Which collection object allows unique value to be inserted only once?,"['The defer attribute can work synchronously.', 'The defer attribute works only with generators.', 'The defer attribute works only with promises.', 'The defer attribute will asynchronously load the scripts in order.']",3
54,What two values will this code print?,"['The condition in the ternary is using the assignment operator.', ""You can't define a variable without initializing it."", ""You can't use a ternary in the right-hand side of an assignment operator."", 'The code is using the deprecated var keyword.']",0
55,How does the forEach() method differ from a for statement?,"[""Document.querySelector('class.pull')"", ""document.querySelector('.pull');"", ""Document.querySelector('pull')"", ""Document.querySelector('#pull')""]",1
56,Which choice is an incorrect way to define an arrow function that returns an empty object?,"['10', 'true', 'false', '0']",0
57,Why might you choose to make your code asynchronous?,"['10', '0', 'ReferenceError', 'undefined']",2
58,Which expression evaluates to true?,"['undefined', '""hello""', 'an object with a constructor property', 'an error message']",2
59,Which of these is a valid variable name?,"['Object', 'Set', 'Array', 'Map']",1
60,Which method cancels event default behavior?,"['1 then 1', '1 then undefined', 'undefined then undefined', 'undefined then 1']",2
61,Which method do you use to attach one DOM node to another?,"['forEach allows you to specify your own iterator, whereas for does not.', 'forEach can be used only with strings, whereas for can be used with additional data types.', 'forEach can be used only with an array, whereas for can be used with additional data types.', 'for loops can be nested; whereas forEach loops cannot.']",2
62,Which statement is used to skip iteration of the loop?,"['=> ({})', '=> {}', '=> { return {};}', '=> (({}))']",1
63,Which choice is valid example for an arrow function?,"['to start tasks that might take some time without blocking subsequent tasks from executing immediately', 'to ensure that tasks further down in your code are not initiated until earlier tasks have completed', 'to make your code faster', 'to ensure that the call stack maintains a LIFO (Last in, First Out) structure']",0
64,Which concept is defined as a template that can be used to generate different objects that share some shape and/or behavior?,"['[3] == [3]', ""3 == '3'"", ""3 != '3'"", ""3 === '3'""]",1
65,How do you add a comment to JavaScript code?,"['5thItem', 'firstName', 'grand total', 'function']",1
66,"If you attempt to call a value as a function but the value is not a function, what kind of error would you get?","['cancel()', 'stop()', 'preventDefault()', 'prevent()']",2
67,Which method is called automatically when an object is initialized?,"['attachNode()', 'getNode()', 'querySelector()', 'appendChild()']",3
68,What is the result of running the statement shown?,"['break', 'pass', 'skip', 'continue']",3
69,"You've written the event listener shown below for a form button, but each time you click the button, the page reloads. Which statement would stop this from happening?","['(a,b) => c', 'a, b => {return c;}', 'a, b => c', '{ a, b } => c']",0
70,Which statement represents the starting code converted to an IIFE?,"['class', 'generator function', 'map', 'proxy']",0
71,Which statement selects all img elements in the DOM tree?,"['! This is a comment', '# This is a comment', '\\\\ This is a comment', '// This is a comment']",3
72,Why would you choose an asynchronous structure for your code?,"['TypeError', 'SystemError', 'SyntaxError', 'LogicError']",0
73,What is the HTTP verb to request the contents of an existing resource?,"['create()', 'new()', 'constructor()', 'init()']",2
74,"Which event is fired on a text field within a form when a user tabs to it, or clicks or touches it?","['4', '10', '6', '5']",2
75,What is the result in the console of running this code?,"['e.blockReload();', 'button.preventDefault();', 'button.blockReload();', 'e.preventDefault();']",3
76,Which class-based component is equivalent to this function component?,"[""function() { console.log('lorem ipsum'); }()();"", ""function() { console.log('lorem ipsum'); }();"", ""(function() { console.log('lorem ipsum'); })();""]",2
77,Which class-based lifecycle method would be called at the same time as this effect Hook?,"[""Document.querySelector('img')"", ""Document.querySelectorAll('<img>')"", ""Document.querySelectorAll('img')"", ""Document.querySelector('<img>')""]",2
78,What is the output of this code?,"['To use ES6 syntax', 'To start tasks that might take some time without blocking subsequent tasks from executing immediately', 'To ensure that parsers enforce all JavaScript syntax rules when processing your code', ""To ensure that tasks further down in your code aren't initiated until earlier tasks have completed""]",1
79,How would you use the TaxCalculator to determine the amount of tax on \$50?,"['DELETE', 'GET', 'PATCH', 'POST']",1
80,What is wrong with this code?,"['focus', 'blur', 'hover', 'enter']",0
81,What will be logged to the console?,"['function', 'undefined', 'Function.prototype', 'window']",3
82,What will this code log to the console?,"['class Greeting extends React.Component { render() { return <h1>Hello {this.props.name}!</h1>; } }', 'class Greeting extends React.Component { constructor() { return <h1>Hello {this.props.name}!</h1>; } }', 'class Greeting extends React.Component { <h>Hello {this.props.name}!</h>; } }', 'class Greeting extends React.Component { render({ name }) { return <h1>Hello {name}!</h1>; } }']",0
83,How do you remove the property name from this object?,"['componentWillUnmount', 'componentDidUpdate', 'render', 'componentDidMount']",3
84,What is the difference between the map() and the forEach() methods on the Array prototype?,"['ReferenceError: obj is not defined', '{}', 'undefined', 'null']",2
85,Which concept does this code illustrate?,"['calculate(50);', 'new TaxCalculator().calculate(\\$50);', 'TaxCalculator.calculate(50);', 'new TaxCalculator().calculate(50);']",2
86,Which tag pair is used in HTML to embed JavaScript?,"['The function bar needs to be defined as a key/value pair.', 'Trailing commas are not allowed in JavaScript.', 'Functions cannot be declared as properties of objects.', '] Nothing, there are no errors.', 'ference functions in javascript', 'erence working with objects']",-1
87,"If your app receives data from a third-party API, which HTTP response header must the server specify to allow exceptions to the same-origin policy?",['.'],0
88,What will be logged to the console??,['.'],-1
89,What will this code print?,"['] The output may change with each execution of code and cannot be determined.', '] .']",-1
90,"Which missing line would allow you to create five variables(one,two,three,four,five) that correspond to their numerical values (1,2,3,4,5)?","['1', 'undefined', 'NaN', 'Nothing--this is not proper JavaScript syntax and will throw an error.']",0
91,What will this code print?,"['delete name from foo;', 'delete foo.name;', 'del foo.name;', 'remove foo.name;']",1
92,"Which line could you add to this code to print ""jaguar"" to the console?","['There is no difference.', 'The forEach() method returns a single output value, whereas the map() method performs operation on each value in the array.', 'The map() methods returns a new array with a transformation applied on each item in the original array, whereas the forEach() method iterates through an array with no return value.', '] The forEach() methods returns a new array with a transformation applied on each item in the original array, whereas the map() method iterates through an array with no return value.', 'ference map', 'erence Differences between forEach and for loop']",2
93,What line is missing from this code?,"['overloading', 'closure', 'currying', 'overriding']",2
94,What will be logged to the console?,"['<script></script>', '<js></js>', '<javascript></javascript>', '<code></code>']",0
95,How would you access the word It from this multidimensional array?,"['Security-Mode', 'Access-Control-Allow-Origin', 'Different-Origin', 'Same-Origin']",1
96,What does this code do?,"['window', 'undefined', 'function', '{desc: ""logger""}']",3
97,What is the output of this code?,"['[""Amazon"",""Borneo"",""Cerrado"",""Congo""]', '[""Cerrado"", ""Congo""]', '[""Congo""]', '[""Amazon"",""Borneo""]']",1
98,Which statement can take a single expression as input and then look through a number of choices until one that matches that value is found?,"['const [one,two,three,four,five]=numbers', 'const {one,two,three,four,five}=numbers', 'const [one,two,three,four,five]=[numbers]', 'const {one,two,three,four,five}={numbers}']",0
99,"Which statement prints ""roar"" to the console?","['Nothing, it will throw an error', '0 2', 'undefined 2', 'undefined 2']",1
100,"Which choice is a valid example of an arrow function, assuming c is defined in the outer scope?","['animals.filter(e => e === ""jaguar"");', 'animals.reverse();', 'animals.shift();', 'animals.pop();']",3
101,Which statement correctly imports this code from some-file.js?,"['let vowels = ""aeiou"".toArray();', 'let vowels = Array.of(""aeiou"");', 'let vowels = {""a"", ""e"", ""i"", ""o"", ""u""};', 'let vowels = ""aeiou"";']",3
102,What will be the output of this code?,"['undefined', 'One', 'true', 'Two']",3
103,Which method call is chained to handle a successful response returned by fetch()?,"['matrix[1[2]]', 'matrix[1][1]', 'matrix[1,2]', 'matrix[1][2]']",1
104,Which choice is not an array method?,"['It adds ""Lizard"" to the start of the animals array.', 'It adds ""Lizard"" to the end of the animals array.', 'It replaces ""Rabbit"" with ""Lizard"" in the animals array.', 'It replaces ""Cat"" with ""Lizard"" in the animals array.']",0
105,Which JavaScript loop ensures that at least a singular iteration will happen?,"['93', '12', '66', '633']",0
106,What will be logged to the console?,"['else', 'when', 'if', 'switch']",3
107,"What is the output that is printed when the div containing the text ""Click Here"" is clicked?","['bear.bind(roar);', 'roar.bind(bear);', 'roar.apply(bear);', '] bear[roar]();', 'ference Apply', 'erence this', 'erence bind']",2
108,What will this code log to the console?,"['a, b => { return c; }', 'a, b => c', '{ a, b } => c', '(a,b) => c']",3
109,What does this code print to the console?,"[""import printMe from './some-file';"", ""import { printMe } from './some-file';"", ""import default as printMe from './some-file';"", ""const printMe = import './some-file';""]",1
110,"Which snippet could you add to this code to print ""YOU GOT THIS"" to the console?","['[2, 3, 4, 5, 6, 7]', '[3,5,7,2,4,6]', '[3, 5, 7, 2, 4, 6]', '[[2, 4, 6], [3, 5, 7]]', '[2, 4, 6, 3, 5, 7]']",4
111,Which Pokemon will be logged to the console?,"['done()', 'then()', 'finally()', 'catch()']",1
112,"Which statement can be used to select the element from the DOM containing the text ""The LinkedIn Learning library has great JavaScript courses"" from this markup?","['array.slice()', 'array.shift()', 'array.push()', 'array.replace()']",3
113,Which value is not falsey?,"['do…while', 'forEach', 'while', 'for']",0
114,What line of code causes this code segment to throw an error?,"['string', 'array', 'Boolean', 'object']",0
115,What will be the value of result after running this code?,"['C B A', 'A', 'C', '] A B C', 'ference query selector', 'erence events']",0
116,"Which snippet could you insert to this code to print ""swim"" to the console?","['[4,5,6,7,8,9,10]', '[4,5,6,7]', '[1,2,3,4,5,6]', '[4,5,6]']",3
117,What is the output of this code?,"['2', '4', '6', '8']",2
118,How can you attempt to access the property a.b on obj without throwing an error if a is undefined?,[''],-1
119,What happens when you run this code?,[''],-1
120,What does this code print to the console?,[''],0
121,"Given this code, which statement will evaluate to false?",[''],-1
122,What will this code log to the console?,"['Charmander', 'Jigglypuff', 'Snorlax', 'Squirtle']",0
123,What is the output of this code?,"['document.querySelector(""div.content"")', 'document.querySelector(""span.content"")', 'document.querySelector("".content"")', 'document.querySelector(""div.span"")']",1
124,What does this code print to the console?,"['[]', 'undefined', '0', 'null']",0
125,What is the output of this code?,"['line 5, because lion cannot be reassigned a value', 'line 6, because the += operator cannot be used with the undefined variable bear', 'line 5, because the prefix (++) operator does not exist in JavaScript', '] line 3, because the variable bear is left undefined', 'ference const in js', 'erence TypeError: invalid assignment to const ""x""']",0
126,What will this code output to the log?,"['It will throw a TypeError.', '[""Name"", ""Age"", ""HairColor""]', '[""DAVE"", 40, ""BLUE""]', '] [""NAME"", ""AGE"", ""HAIRCOLOR""]', 'ference Object.keys()', 'erence Array.prototype.map()', 'erence String.prototype.toUpperCase()']",-1
127,What will this code print to the console?,"['animals.every(key)', 'animals.some(key).length === 1', 'animals.filter(key) === true', 'animals.some(key)']",3
128,What will this code print to the console?,"['undefined', 'None of these answers, as static is not a feature in Javascript.', '60', '80']",0
129,Which code would you use to access the Irish flag?,"['obj?.a.b', 'obj.a?.b', 'obj[a][b]', 'obj.?a.?b']",1
130,,"['It will throw a ReferenceError about x.', 'It will print 18.', 'It will print undefined.', 'It will throw a ReferenceError about y.']",3
131,,"['[1,2,5,7]', '[[1, 2], [5, 7]]', '[2,7]', '[2,1,7,5]']",0
132,,"[""a['x'] === b['x']"", 'a != b', 'a === b', 'a.x === b.x']",2
133,,"['Nothing. It resuults in a ReferenceError.', 'decimal', 'float', 'number']",3
134,,"['3', '4', '6', '] 7', 'ference', 'erence', 'erence']",1
135,,"['Nothing is printed to the console.', 'grunt', 'undefined', 'roar']",2
136,,"['undefined', 'Wild', 'Tabby', 'Athena']",1
137,,"['null no arg', 'no arg no arg', 'null null', 'no arg null']",3
138,,"['a is 1', 'a is undefined', ""It won't print anything."", 'a is 2']",3
139,,"['8', '6', '2', '12']",0
140,,"['flagDatabase.countries[1].flag', 'flagDatabase.countries[0].flag', 'flagDatabase[1].flag', 'flagsJSON.countries[0].flag']",1
